GFS Classification,Sector,Revenue stream name,Government entity,Revenue value,Currency,Country,ISO Code,Year,Start Date,End Date
"Extraordinary taxes on income, profits and capital gains (1112E2)",Oil & Gas,Petroleum Revenue Tax (PRT),Her Majesty’s Revenue and Customs (HMRC),-837756974.0,GBP,United Kingdom,GBR,2018,2018-01-01,2018-12-31
"Extraordinary taxes on income, profits and capital gains (1112E2)",Oil & Gas,Ring Fence CT and Supplementary Charge (RFCT & SC),Her Majesty’s Revenue and Customs (HMRC),1938928679.53,GBP,United Kingdom,GBR,2018,2018-01-01,2018-12-31
Licence fees (114521E),Mining,Payments to Crown Estate Scotland M&Q,Crown Estate Scotland (CES),212258.4,GBP,United Kingdom,GBR,2018,2018-01-01,2018-12-31
Licence fees (114521E),Mining,Payments to the Crown Estate M&Q,The Crown Estate (TCE),21971914.22,GBP,United Kingdom,GBR,2018,2018-01-01,2018-12-31
Licence fees (114521E),Oil & Gas,Payments to Crown Estate Scotland O&G,Crown Estate Scotland (CES),1900894.75,GBP,United Kingdom,GBR,2018,2018-01-01,2018-12-31
Licence fees (114521E),Oil & Gas,Payments to the Crown Estate O&G,The Crown Estate (TCE),3202712.55,GBP,United Kingdom,GBR,2018,2018-01-01,2018-12-31
Licence fees (114521E),Oil & Gas,Petroleum Licence Fees,Oil & Gas Authority (OGA),66823846.76,GBP,United Kingdom,GBR,2018,2018-01-01,2018-12-31
"Ordinary taxes on income, profits and capital gains (1112E1)",Mining,Corporation Tax,Her Majesty’s Revenue and Customs (HMRC),32851771.09,GBP,United Kingdom,GBR,2018,2018-01-01,2018-12-31
Other taxes payable by natural resource companies (116E),Oil & Gas,Oil & Gas Authority (OGA) Levy,Oil & Gas Authority (OGA),22078928.86,GBP,United Kingdom,GBR,2018,2018-01-01,2018-12-31
