GFS Classification,Sector,Revenue stream name,Government entity,Revenue value,Currency,Country,ISO Code,Year,Start Date,End Date
"Extraordinary taxes on income, profits and capital gains (1112E2)",Oil & Gas,Petroleum Revenue Tax (PRT),Her Majesty’s Revenue and Customs (HMRC),-445176091.0,GBP,United Kingdom,GBR,2020,2020-01-01,2020-12-31
Licence fees (114521E),Mining,Payments to Crown Estate Scotland M&Q,Crown Estate Scotland (CES),99435.0,GBP,United Kingdom,GBR,2020,2020-01-01,2020-12-31
Licence fees (114521E),Mining,Payments to the Crown Estate M&Q,The Crown Estate (TCE),21711580.0,GBP,United Kingdom,GBR,2020,2020-01-01,2020-12-31
Licence fees (114521E),Oil & Gas,Payments to Crown Estate Scotland O&G,Crown Estate Scotland (CES),1562910.0,GBP,United Kingdom,GBR,2020,2020-01-01,2020-12-31
Licence fees (114521E),Oil & Gas,Payments to the Crown Estate O&G,The Crown Estate (TCE),3218019.75,GBP,United Kingdom,GBR,2020,2020-01-01,2020-12-31
Licence fees (114521E),Oil & Gas,Petroleum Licence Fees,Oil & Gas Authority (OGA),55709437.59,GBP,United Kingdom,GBR,2020,2020-01-01,2020-12-31
"Ordinary taxes on income, profits and capital gains (1112E1)",Mining,Corporation Tax,Her Majesty’s Revenue and Customs (HMRC),21661391.84,GBP,United Kingdom,GBR,2020,2020-01-01,2020-12-31
"Ordinary taxes on income, profits and capital gains (1112E1)",Oil & Gas,Ring Fence CT and Supplementary Charge (RFCT & SC),Her Majesty’s Revenue and Customs (HMRC),578213066.0,GBP,United Kingdom,GBR,2020,2020-01-01,2020-12-31
Other taxes payable by natural resource companies (116E),Oil & Gas,Oil & Gas Authority (OGA) Levy,Oil & Gas Authority (OGA),29313057.9,GBP,United Kingdom,GBR,2020,2020-01-01,2020-12-31
